{
  "$schema": "https://json-schema.org/draft/2020-12/schema",
  "title": "TechSpecter Fingerprint",
  "type": "object",
  "required": ["id", "name", "category", "patterns"],
  "additionalProperties": true,
  "properties": {
    "id": {"type": "string", "minLength": 1},
    "name": {"type": "string", "minLength": 1},
    "category": {"type": "string", "minLength": 1},
    "website": {"type": "string"},
    "description": {"type": "string"},
    "priority": {"type": "integer", "minimum": 0},
    "confidence": {"type": "number", "minimum": 0, "maximum": 100},
    "tags": {"type": "array", "items": {"type": "string"}},
    "patterns": {
      "type": "array",
      "items": {
        "type": "object",
        "required": ["matcher", "pattern"],
        "properties": {
          "matcher": {
            "type": "string",
            "enum": ["string", "regex", "filename", "sourcemap", "global"]
          },
          "pattern": {"type": "string", "minLength": 1},
          "weight": {"type": "number", "minimum": 0, "maximum": 100},
          "flags": {"type": "string"}
        },
        "additionalProperties": true
      }
    },
    "version_patterns": {
      "type": "array",
      "items": {
        "type": "object",
        "required": ["pattern"],
        "properties": {
          "pattern": {"type": "string", "minLength": 1},
          "weight": {"type": "number", "minimum": 0, "maximum": 100},
          "flags": {"type": "string"}
        },
        "additionalProperties": true
      }
    }
  }
}
