{
  "id": "webpack",
  "name": "webpack",
  "category": "build-tool",
  "website": "https://webpack.js.org",
  "description": "Static module bundler",
  "priority": 85,
  "confidence": 80,
  "tags": [
    "javascript",
    "build",
    "bundler"
  ],
  "patterns": [
    {
      "matcher": "filename",
      "pattern": "webpack",
      "weight": 20
    },
    {
      "matcher": "string",
      "pattern": "__webpack_require__",
      "weight": 40
    },
    {
      "matcher": "string",
      "pattern": "__webpack_modules__",
      "weight": 38
    },
    {
      "matcher": "global",
      "pattern": "webpackBootstrap",
      "weight": 30
    },
    {
      "matcher": "string",
      "pattern": "webpackChunk",
      "weight": 35
    },
    {
      "matcher": "regex",
      "pattern": "webpackJsonp",
      "weight": 32
    }
  ],
  "version_patterns": []
}
