{
  "id": "material-ui",
  "name": "Material UI",
  "category": "css-framework",
  "website": "https://mui.com",
  "description": "React component library implementing Material Design",
  "priority": 85,
  "confidence": 80,
  "tags": [
    "css",
    "ui",
    "frontend",
    "react"
  ],
  "patterns": [
    {
      "matcher": "filename",
      "pattern": "mui",
      "weight": 20
    },
    {
      "matcher": "string",
      "pattern": "@mui/material",
      "weight": 40
    },
    {
      "matcher": "string",
      "pattern": "@mui/icons-material",
      "weight": 35
    },
    {
      "matcher": "string",
      "pattern": "@mui/system",
      "weight": 32
    },
    {
      "matcher": "string",
      "pattern": "MuiThemeProvider",
      "weight": 30
    },
    {
      "matcher": "string",
      "pattern": "StyledEngineProvider",
      "weight": 28
    }
  ],
  "version_patterns": []
}
