{
  "id": "turbopack",
  "name": "Turbopack",
  "category": "build-tool",
  "website": "https://turbo.build/pack",
  "description": "Rust-based bundler",
  "priority": 75,
  "confidence": 75,
  "tags": [
    "javascript",
    "build",
    "bundler"
  ],
  "patterns": [
    {
      "matcher": "filename",
      "pattern": "turbopack",
      "weight": 25
    },
    {
      "matcher": "string",
      "pattern": "TURBOPACK",
      "weight": 35
    },
    {
      "matcher": "string",
      "pattern": "__turbopack_load__",
      "weight": 38
    },
    {
      "matcher": "string",
      "pattern": "turbopack-runtime",
      "weight": 35
    },
    {
      "matcher": "string",
      "pattern": "next/dist/compiled/@vercel/turbopack",
      "weight": 40
    }
  ],
  "version_patterns": []
}
