{
  "id": "bootstrap",
  "name": "Bootstrap",
  "category": "css-framework",
  "website": "https://getbootstrap.com",
  "description": "Popular CSS framework",
  "priority": 80,
  "confidence": 75,
  "tags": [
    "css",
    "ui",
    "frontend"
  ],
  "patterns": [
    {
      "matcher": "filename",
      "pattern": "bootstrap",
      "weight": 25
    },
    {
      "matcher": "string",
      "pattern": "data-bs-toggle",
      "weight": 30
    },
    {
      "matcher": "string",
      "pattern": "bootstrap.min.css",
      "weight": 30
    },
    {
      "matcher": "regex",
      "pattern": "Bootstrap(?:\\s|\\.)v?[0-9]",
      "weight": 25
    }
  ],
  "version_patterns": []
}
