{
  "id": "nuxt",
  "name": "Nuxt",
  "category": "framework",
  "website": "https://nuxt.com",
  "description": "Intuitive Vue framework for building universal applications",
  "priority": 95,
  "confidence": 85,
  "tags": ["javascript", "framework", "vue", "ssr"],
  "patterns": [
    {"matcher": "filename", "pattern": "nuxt", "weight": 25},
    {"matcher": "string", "pattern": "__NUXT__", "weight": 40},
    {"matcher": "string", "pattern": "window.__NUXT__", "weight": 35},
    {"matcher": "regex", "pattern": "_nuxt/", "weight": 20}
  ],
  "version_patterns": [
    {"pattern": "nuxt@([0-9][0-9a-zA-Z.+-_]*)", "weight": 20}
  ]
}
